id,time,title,type,score,by,descendants,url
15733221,1511086862,A Complete Guide to Startup Advisors and Mentors,story,1,FooBarWidget,0,https://medium.com/swlh/a-complete-guide-to-startup-advisors-and-mentors-5d5704dc7e84
15733205,1511086558,Ask HN: What three programming technologies do you know best?,story,1,hguhghuff,0,
15733202,1511086526,Y Combinator has quietly cut ties with Peter Thiel,story,1,s_kilk,0,https://www.theverge.com/2017/11/18/16673408/peter-thiel-no-longer-works-with-y-combinator
15733167,1511085949,HN Meetup Notes: 5 Things Pilots Can Teach Entrepreneurs,story,1,jkuria,0,https://capitalandgrowth.org/articles/438/4-and-a-half-things-entrepreneurs-can-learn-from-p.html?src=nov-hn
15733163,1511085860,Ask HN: What is the most productive browser extension that you use daily?,story,1,wallzz,0,
